id,text,file,node,lineNumber
line:0497f8d,Player: <shake>No no no</shake>,Intro 2,Intro.Start2,7
line:029e05d,Player: Me estás bromeando?,Intro 2,Intro.Start2,8
line:055ec3a,Player: Qué diablos pasa con esta cosa?,Intro 2,Intro.Start2,9
line:0782042,Player: <shake>Uggghh</shake>,Intro 2,Intro.Start2,10
line:057eda1,Player: No quiero lidiar con esto ahora mismo,Intro 2,Intro.Start2,11
line:0feb9e9,Player: *suspiro*,Intro 2,Intro.Start2,12
line:057e916,Player: Probablemente deba consultar a los demás,Intro 2,Intro.Start2,13
line:0e59271,Player: Tal vez estén relacionados con esto,Intro 2,Intro.Start2,14
